{
  "schemaVersion": "study-math.v1",
  "subject": {
    "id": "math-1",
    "title": "数学一",
    "learningStatus": "可用于考试"
  },
  "modules": [
    {
      "id": "math-1",
      "parentId": null,
      "kind": "subject",
      "title": "数学一",
      "aliases": ["考研数学一"],
      "order": 0,
      "sourceIds": ["math-1-scope"],
      "status": "COMPLETE"
    },
    {
      "id": "calculus",
      "parentId": "math-1",
      "kind": "course",
      "title": "高等数学",
      "aliases": ["高数"],
      "order": 1,
      "sourceIds": ["math-1-scope"],
      "status": "COMPLETE"
    },
    {
      "id": "limits",
      "parentId": "calculus",
      "kind": "chapter",
      "title": "函数与极限",
      "aliases": ["极限"],
      "order": 1,
      "sourceIds": ["limit-definition-text"],
      "status": "COMPLETE"
    },
    {
      "id": "mean-value-theorems",
      "parentId": "calculus",
      "kind": "chapter",
      "title": "中值定理",
      "aliases": ["微分中值定理"],
      "order": 3,
      "sourceIds": ["lagrange-text"],
      "status": "COMPLETE"
    },
    {
      "id": "series",
      "parentId": "calculus",
      "kind": "chapter",
      "title": "无穷级数",
      "aliases": ["级数"],
      "order": 7,
      "sourceIds": ["series-overview"],
      "status": "COMPLETE"
    },
    {
      "id": "positive-series",
      "parentId": "series",
      "kind": "section",
      "title": "正项级数",
      "aliases": ["正项"],
      "order": 1,
      "sourceIds": ["positive-series-text"],
      "status": "COMPLETE"
    },
    {
      "id": "sequences",
      "parentId": "limits",
      "kind": "section",
      "title": "递推数列",
      "aliases": ["数列极限"],
      "order": 2,
      "sourceIds": ["recurrence-text"],
      "status": "COMPLETE"
    }
  ],
  "cards": [
    {
      "id": "function-limit-definition",
      "moduleId": "limits",
      "parentId": "limits",
      "type": "definition",
      "title": "函数极限",
      "recallPrompt": "函数在 x0 处的极限到底是什么意思？",
      "atomicity": {
        "coreQuestion": "如何准确说出函数极限的对象、条件和结论？",
        "independentRecallTasks": 1,
        "splitCandidates": []
      },
      "operationTags": ["limit_definition"],
      "definition": "函数值在自变量趋近目标点时可以无限接近某个确定值的定义。",
      "notation": "lim_{x→x0} f(x)=A",
      "domain": ["x 在定义域内趋近 x0", "极限只讨论趋近过程，不要求 f(x0) 已定义"],
      "intuition": "控制 x 与 x0 的距离，就能控制 f(x) 与 A 的距离。",
      "equivalentViews": ["ε-δ 语言", "序列判别语言"],
      "contrasts": ["函数值 f(x0)", "函数在 x0 处连续"],
      "minimumExample": "lim_{x→0} sin(x)/x = 1",
      "understand": "定义卡先区分趋近过程、函数值和连续性。",
      "conditions": ["目标点附近有定义域中的点"],
      "pitfalls": ["把 f(x0) 当成极限值", "忘记说明趋近方向或定义域"],
      "recommendedQuestionIds": [],
      "questionIds": [],
      "sourceIds": ["limit-definition-text"],
      "relationIds": ["limit-prerequisite-lagrange"]
    },
    {
      "id": "lagrange-mean-value-theorem",
      "moduleId": "mean-value-theorems",
      "parentId": "mean-value-theorems",
      "type": "theorem",
      "title": "Lagrange 中值定理",
      "recallPrompt": "使用 Lagrange 中值定理前必须验证哪两个区间条件？",
      "atomicity": {
        "coreQuestion": "如何检查条件并写出 Lagrange 中值定理的结论？",
        "independentRecallTasks": 1,
        "splitCandidates": []
      },
      "operationTags": ["lagrange_theorem", "derivative_application"],
      "preconditions": ["f 在 [a,b] 上连续", "f 在 (a,b) 内可导", "a<b"],
      "conclusion": "存在 ξ∈(a,b)，使 f'(ξ)=(f(b)-f(a))/(b-a)。",
      "conditionRoles": {
        "closed_interval_continuity": "保证端点值和整体连续性",
        "open_interval_differentiability": "保证可以使用导数表达局部变化"
      },
      "uses": ["证明存在性", "估计函数增量", "判断方程根或不等式"],
      "failureConditions": ["缺少连续性或可导性时不能直接套用"],
      "misuses": ["把 ξ 当成端点", "只写结论不检查前提"],
      "understand": "定理卡把条件、条件作用和结论绑定。",
      "conditions": ["闭区间与开区间条件不能交换"],
      "pitfalls": ["忘记 ξ 的范围", "将平均变化率当成某个固定点值"],
      "recommendedQuestionIds": [],
      "questionIds": [],
      "sourceIds": ["lagrange-text"],
      "relationIds": ["limit-prerequisite-lagrange"]
    },
    {
      "id": "ratio-test",
      "moduleId": "positive-series",
      "parentId": "positive-series",
      "type": "method",
      "title": "比值判别法",
      "recallPrompt": "什么结构优先考虑比值判别法？",
      "atomicity": {
        "coreQuestion": "如何识别并执行比值判别法？",
        "independentRecallTasks": 1,
        "splitCandidates": []
      },
      "operationTags": ["series_ratio_test", "convergence_decision"],
      "understand": "面对阶乘、指数、连乘或相邻项容易约分的正项级数，比较相邻项绝对值的比值。",
      "signals": ["n!", "a^n", "连乘结构", "相邻项容易约分"],
      "formulae": [
        {
          "latex": "\\rho=\\lim_{n\\to\\infty}\\left|\\frac{u_{n+1}}{u_n}\\right|",
          "conditions": ["极限存在或可用上极限判断"]
        }
      ],
      "conditions": ["ρ<1 时收敛", "ρ>1 时发散", "ρ=1 时本方法失效"],
      "steps": [
        "写出 u_{n+1}",
        "作比 |u_{n+1}/u_n|",
        "约分化简",
        "求 n→∞ 的极限 ρ",
        "将 ρ 与 1 比较并停止在正确结论"
      ],
      "stopRule": "ρ=1 时停止使用本判别法，改用其他判别方法。",
      "failureConditions": ["ρ=1 不能继续推出收敛或发散"],
      "alternatives": ["根值判别法", "比较判别法", "积分判别法"],
      "pitfalls": ["把 u_n/u_{n+1} 写反", "ρ=1 时强行下结论"],
      "recommendedQuestionIds": ["series-mcq-12"],
      "questionIds": ["series-mcq-12"],
      "sourceIds": ["series-textbook-ratio"],
      "relationIds": ["ratio-part-of-positive", "ratio-alternative-root", "ratio-used-by-radius"]
    },
    {
      "id": "recurrence-limit-pattern",
      "moduleId": "sequences",
      "parentId": "sequences",
      "type": "problem-pattern",
      "title": "递推数列求极限",
      "recallPrompt": "递推数列求极限时第一步应该判断什么？",
      "atomicity": {
        "coreQuestion": "如何用单调有界和极限方程处理递推数列？",
        "independentRecallTasks": 1,
        "splitCandidates": []
      },
      "operationTags": ["recurrence_limit", "monotone_bounded"],
      "recognitionSignals": ["a_{n+1}=φ(a_n)", "给出初值", "要求数列极限"],
      "firstStep": "先猜测不动点并独立检查数列是否有界、是否单调。",
      "decisionTree": [
        "先求 φ(x)=x 的候选极限",
        "再用归纳或差值判断有界性与单调性",
        "由单调有界定理确认收敛后代入极限方程"
      ],
      "tools": ["单调有界定理", "数学归纳法", "连续函数极限传递"],
      "branches": [
        {"condition": "递推函数单调且区间保持不变", "action": "证明不变区间后判断单调性"},
        {"condition": "无法直接证明单调", "action": "寻找压缩估计或比较数列"}
      ],
      "closingChecks": ["候选根是否在可达区间", "是否先证明收敛再代入"],
      "typicalTraps": ["直接把 a_n 和 a_{n+1} 都替换成极限而不证明收敛"],
      "understand": "题型卡负责拆题顺序，不复制大量递推题。",
      "conditions": ["极限方程只能在已证明收敛后使用"],
      "pitfalls": ["漏证有界或单调", "忽略初值决定的可达区间"],
      "recommendedQuestionIds": [],
      "questionIds": [],
      "sourceIds": ["recurrence-text"],
      "relationIds": []
    },
    {
      "id": "series-test-bridge",
      "moduleId": "series",
      "parentId": "series",
      "type": "bridge",
      "title": "级数判别选择图",
      "recallPrompt": "看到一个级数时，先按什么结构选择判别方法？",
      "atomicity": {
        "coreQuestion": "如何从级数结构选择第一个判别工具？",
        "independentRecallTasks": 1,
        "splitCandidates": []
      },
      "operationTags": ["series_method_selection"],
      "decisionQuestion": "这是正项级数、交错级数、任意项级数还是幂级数？",
      "branches": [
        {"condition": "正项且相邻项容易约分", "targetCardId": "ratio-test"},
        {"condition": "正项且 n 次根容易处理", "targetCardId": "root-test"},
        {"condition": "幂级数", "targetCardId": "power-series-radius"},
        {"condition": "交错项", "targetCardId": "alternating-series"}
      ],
      "outgoingRelationIds": ["bridge-to-ratio", "bridge-to-root", "bridge-to-radius", "bridge-to-alternating"],
      "closingChecks": ["比值极限等于 1 时换方法", "幂级数端点必须单独判断"],
      "understand": "Bridge 把方法选择连接到真实的 typed relation。",
      "conditions": ["先识别项的符号和题目目标"],
      "pitfalls": ["把所有级数都送进同一个判别法"],
      "recommendedQuestionIds": [],
      "questionIds": [],
      "sourceIds": ["series-method-map"],
      "relationIds": ["bridge-to-ratio", "bridge-to-root", "bridge-to-radius", "bridge-to-alternating"]
    },
    {
      "id": "positive-series",
      "moduleId": "positive-series",
      "parentId": "positive-series",
      "type": "definition",
      "title": "正项级数",
      "recallPrompt": "什么条件使一个级数成为正项级数？",
      "atomicity": {
        "coreQuestion": "如何识别正项级数及其判别入口？",
        "independentRecallTasks": 1,
        "splitCandidates": []
      },
      "operationTags": ["positive_series"],
      "definition": "从某项起 u_n≥0 的级数称为正项级数。",
      "notation": "Σu_n，u_n≥0",
      "domain": ["从某一项开始满足非负性即可"],
      "intuition": "部分和单调不减，因此核心转为判断是否有上界。",
      "equivalentViews": ["部分和单调性", "比较判别入口"],
      "contrasts": ["交错级数", "任意项级数"],
      "minimumExample": "Σ1/2^n",
      "understand": "正项性是选择比较、比值、根值和积分判别的结构信号。",
      "conditions": ["非负性可从某一项开始成立"],
      "pitfalls": ["把绝对值后的级数当作原级数而忘记答案目标"],
      "recommendedQuestionIds": ["series-mcq-12"],
      "questionIds": ["series-mcq-12"],
      "sourceIds": ["positive-series-text"],
      "relationIds": ["ratio-part-of-positive"]
    },
    {
      "id": "root-test",
      "moduleId": "positive-series",
      "parentId": "positive-series",
      "type": "method",
      "title": "根值判别法",
      "recallPrompt": "什么时候相邻项比值不方便而应考虑根值判别法？",
      "atomicity": {
        "coreQuestion": "如何用通项的 n 次根判断级数敛散性？",
        "independentRecallTasks": 1,
        "splitCandidates": []
      },
      "operationTags": ["series_root_test", "convergence_decision"],
      "understand": "当通项含有整体 n 次幂结构时，n 次根可能比相邻项比值更直接。",
      "signals": ["整体 n 次幂", "指数结构明显"],
      "formulae": [
        {
          "latex": "\\rho=\\lim_{n\\to\\infty}\\sqrt[n]{|u_n|}",
          "conditions": ["ρ<1 收敛，ρ>1 发散，ρ=1 失效"]
        }
      ],
      "conditions": ["需要比较根值与 1"],
      "steps": ["取 |u_n| 的 n 次根", "化简", "求极限", "与 1 比较"],
      "stopRule": "ρ=1 时换用其他判别法。",
      "failureConditions": ["ρ=1 时不能判断"],
      "alternatives": ["比值判别法", "比较判别法"],
      "pitfalls": ["忘记 n 次根的极限运算", "ρ=1 强行结论"],
      "recommendedQuestionIds": [],
      "questionIds": [],
      "sourceIds": ["root-test-text"],
      "relationIds": ["ratio-alternative-root"]
    },
    {
      "id": "power-series-radius",
      "moduleId": "series",
      "parentId": "series",
      "type": "formula",
      "title": "幂级数收敛半径",